{
  "$schema": "https://json-schema.org/draft/2020-12/schema",
  "$id": "https://rook.local/schemas/task.schema.json",
  "title": "Rook Task",
  "type": "object",
  "additionalProperties": false,
  "required": [
    "task_id",
    "project_id",
    "title",
    "description",
    "status",
    "assigned_agent",
    "priority",
    "dependencies",
    "related_repo",
    "branch",
    "commits",
    "timestamps"
  ],
  "properties": {
    "task_id": {
      "type": "string",
      "minLength": 3
    },
    "project_id": {
      "type": "string",
      "minLength": 2
    },
    "title": {
      "type": "string",
      "minLength": 3
    },
    "description": {
      "type": "string",
      "minLength": 3
    },
    "intake": {
      "type": "object",
      "additionalProperties": false,
      "properties": {
        "brief": {
          "type": [
            "string",
            "null"
          ]
        },
        "refinement_source": {
          "type": [
            "string",
            "null"
          ]
        },
        "refined_at": {
          "type": [
            "string",
            "null"
          ],
          "format": "date-time"
        },
        "refinement_summary": {
          "type": [
            "string",
            "null"
          ]
        }
      }
    },
    "status": {
      "type": "string",
      "enum": [
        "backlog",
        "intake",
        "ready",
        "in_progress",
        "review",
        "testing",
        "blocked",
        "done"
      ]
    },
    "assigned_agent": {
      "type": "string",
      "enum": [
        "rook",
        "engineer",
        "researcher",
        "test",
        "review",
        "consultant",
        "coach",
        "health",
        "dashboard-sync"
      ]
    },
    "claimed_by": {
      "type": [
        "string",
        "null"
      ]
    },
    "blocked_by": {
      "type": "array",
      "items": {
        "type": "string"
      }
    },
    "priority": {
      "type": "string",
      "enum": [
        "low",
        "medium",
        "high",
        "urgent"
      ]
    },
    "dependencies": {
      "type": "array",
      "items": {
        "type": "string"
      }
    },
    "related_repo": {
      "type": "string",
      "pattern": "^[^/]+/[^/]+$"
    },
    "branch": {
      "type": "string",
      "minLength": 1
    },
    "commits": {
      "type": "array",
      "items": {
        "type": "string"
      }
    },
    "commit_refs": {
      "type": "array",
      "items": {
        "type": "string"
      }
    },
    "labels": {
      "type": "array",
      "items": {
        "type": "string"
      }
    },
    "workflow_stage": {
      "type": "string"
    },
    "blocked_reason": {
      "type": [
        "string",
        "null"
      ]
    },
    "handoff_notes": {
      "type": "string"
    },
    "last_heartbeat": {
      "type": [
        "string",
        "null"
      ],
      "format": "date-time"
    },
    "failure_reason": {
      "type": [
        "string",
        "null"
      ]
    },
    "source_channel": {
      "type": [
        "string",
        "null"
      ]
    },
    "artifacts": {
      "type": "array",
      "items": {
        "type": "string"
      }
    },
    "checklist": {
      "type": "array",
      "items": {
        "type": "object",
        "additionalProperties": false,
        "required": [
          "title",
          "completed",
          "position"
        ],
        "properties": {
          "title": {
            "type": "string"
          },
          "completed": {
            "type": "boolean"
          },
          "position": {
            "type": "integer",
            "minimum": 0
          }
        }
      }
    },
    "plan": {
      "type": "object",
      "additionalProperties": false,
      "properties": {
        "approach": { "type": "string" },
        "scope": { "type": "array", "items": { "type": "string" } },
        "out_of_scope": { "type": "array", "items": { "type": "string" } },
        "steps": {
          "type": "array",
          "items": {
            "type": "object",
            "additionalProperties": false,
            "required": ["id", "title", "owner", "completed"],
            "properties": {
              "id": { "type": "string" },
              "title": { "type": "string" },
              "owner": { "type": "string" },
              "completed": { "type": "boolean" }
            }
          }
        },
        "acceptance_criteria": {
          "type": "array",
          "items": {
            "type": "object",
            "additionalProperties": false,
            "required": ["id", "description"],
            "properties": {
              "id": { "type": "string" },
              "description": { "type": "string" },
              "met": { "type": ["boolean", "null"] }
            }
          }
        },
        "risks": { "type": "array", "items": { "type": "string" } },
        "context": { "type": "string" },
        "planned_by": { "type": "string" },
        "planned_at": { "type": "string", "format": "date-time" }
      }
    },
    "test_evidence": {
      "type": "object",
      "additionalProperties": false,
      "properties": {
        "status": {
          "type": [
            "string",
            "null"
          ],
          "enum": [
            "passed",
            "failed",
            null
          ]
        },
        "commands": {
          "type": "array",
          "items": {
            "type": "string"
          }
        },
        "summary": {
          "type": [
            "string",
            "null"
          ]
        }
      }
    },
    "review_evidence": {
      "type": "object",
      "additionalProperties": false,
      "properties": {
        "verdict": {
          "type": [
            "string",
            "null"
          ],
          "enum": [
            "approved",
            "changes_requested",
            null
          ]
        },
        "summary": {
          "type": [
            "string",
            "null"
          ]
        }
      }
    },
    "dispatch": {
      "type": "object",
      "additionalProperties": false,
      "properties": {
        "mode": {
          "type": [
            "string",
            "null"
          ]
        },
        "executor": {
          "type": [
            "string",
            "null"
          ]
        },
        "attempts": {
          "type": [
            "integer",
            "null"
          ],
          "minimum": 0
        },
        "launched_at": {
          "type": [
            "string",
            "null"
          ],
          "format": "date-time"
        },
        "last_checked_at": {
          "type": [
            "string",
            "null"
          ],
          "format": "date-time"
        },
        "model": {
          "type": [
            "string",
            "null"
          ]
        },
        "thinking": {
          "type": [
            "string",
            "null"
          ]
        },
        "session_key": {
          "type": [
            "string",
            "null"
          ]
        },
        "session_id": {
          "type": [
            "string",
            "null"
          ]
        },
        "dispatched_status": {
          "type": [
            "string",
            "null"
          ]
        },
        "dispatched_owner": {
          "type": [
            "string",
            "null"
          ]
        },
        "last_result": {
          "type": [
            "string",
            "null"
          ]
        },
        "last_error": {
          "type": [
            "string",
            "null"
          ]
        }
      }
    },
    "kanban": {
      "type": "object",
      "additionalProperties": false,
      "required": [
        "board_id",
        "board_name",
        "column_id",
        "column_name",
        "task_db_id",
        "position",
        "sync_origin"
      ],
      "properties": {
        "board_id": {
          "type": "string"
        },
        "board_name": {
          "type": "string"
        },
        "column_id": {
          "type": "string"
        },
        "column_name": {
          "type": "string"
        },
        "task_db_id": {
          "type": "string"
        },
        "position": {
          "type": "integer",
          "minimum": 0
        },
        "sync_origin": {
          "type": "string",
          "enum": [
            "dashboard-kanban"
          ]
        }
      }
    },
    "github_issue": {
      "type": "object",
      "additionalProperties": false,
      "required": [
        "repo",
        "sync_status"
      ],
      "properties": {
        "repo": {
          "type": "string",
          "pattern": "^[^/]+/[^/]+$"
        },
        "number": {
          "type": [
            "integer",
            "null"
          ],
          "minimum": 1
        },
        "url": {
          "type": [
            "string",
            "null"
          ]
        },
        "state": {
          "type": [
            "string",
            "null"
          ],
          "enum": [
            "open",
            "closed",
            null
          ]
        },
        "sync_status": {
          "type": "string",
          "enum": [
            "not_requested",
            "pending",
            "synced",
            "error"
          ]
        },
        "last_synced_at": {
          "type": [
            "string",
            "null"
          ],
          "format": "date-time"
        },
        "last_error": {
          "type": [
            "string",
            "null"
          ]
        }
      }
    },
    "github_pull_request": {
      "type": "object",
      "additionalProperties": false,
      "required": [
        "repo"
      ],
      "properties": {
        "repo": {
          "type": "string",
          "pattern": "^[^/]+/[^/]+$"
        },
        "number": {
          "type": [
            "integer",
            "null"
          ],
          "minimum": 1
        },
        "url": {
          "type": [
            "string",
            "null"
          ]
        },
        "state": {
          "type": [
            "string",
            "null"
          ],
          "enum": [
            "open",
            "closed",
            "merged",
            null
          ]
        },
        "title": {
          "type": [
            "string",
            "null"
          ]
        },
        "last_synced_at": {
          "type": [
            "string",
            "null"
          ],
          "format": "date-time"
        },
        "last_error": {
          "type": [
            "string",
            "null"
          ]
        }
      }
    },
    "timestamps": {
      "type": "object",
      "additionalProperties": false,
      "required": [
        "created_at",
        "updated_at",
        "started_at",
        "completed_at"
      ],
      "properties": {
        "created_at": {
          "type": "string",
          "format": "date-time"
        },
        "updated_at": {
          "type": "string",
          "format": "date-time"
        },
        "started_at": {
          "type": [
            "string",
            "null"
          ],
          "format": "date-time"
        },
        "claimed_at": {
          "type": [
            "string",
            "null"
          ],
          "format": "date-time"
        },
        "completed_at": {
          "type": [
            "string",
            "null"
          ],
          "format": "date-time"
        }
      }
    }
  }
}
