{
  "task_id": "ops-0033",
  "project_id": "rook-workspace",
  "title": "Tokens: distinguish local alert threshold from real provider budget",
  "description": "The /tokens page currently shows a daily budget warning based only on a local UI threshold, which can be confused with a real provider/account spending limit. Update the page so it clearly separates local alert threshold from actual provider budget/spend data. If possible, add provider-aware budget visibility or explicitly mark that provider budget is not yet connected.",
  "intake": {
    "brief": null,
    "refinement_source": null,
    "refined_at": null,
    "refinement_summary": null
  },
  "status": "backlog",
  "assigned_agent": "engineer",
  "claimed_by": null,
  "priority": "medium",
  "dependencies": [],
  "blocked_by": [],
  "related_repo": "MarcusGraetsch/rook-dashboard",
  "branch": "agent/engineer/ops-0033-tokens-distinguish-local-alert-threshold-from-re",
  "commits": [],
  "commit_refs": [],
  "labels": [
    "dashboard",
    "tokens",
    "ux",
    "billing"
  ],
  "workflow_stage": "kanban-sync",
  "blocked_reason": null,
  "handoff_notes": "",
  "last_heartbeat": null,
  "failure_reason": null,
  "source_channel": null,
  "artifacts": [],
  "checklist": [],
  "kanban": {
    "board_id": "995cdcf8-3eda-4bb8-8ce2-c85a10791d95",
    "board_name": "Rook System",
    "column_id": "61aa5f4b-36fb-4be6-acdd-a6bab9ffbb9d",
    "column_name": "Backlog",
    "task_db_id": "ce49ea59-137a-432d-a0ac-43426da496a2",
    "position": 13,
    "sync_origin": "dashboard-kanban"
  },
  "github_issue": {
    "repo": "MarcusGraetsch/rook-dashboard",
    "number": 52,
    "url": "https://github.com/MarcusGraetsch/rook-workspace/issues/52",
    "state": null,
    "sync_status": "error",
    "last_synced_at": null,
    "last_error": "cannot iterate over: null"
  },
  "timestamps": {
    "created_at": "2026-04-10T15:09:41.992Z",
    "updated_at": "2026-05-05T13:59:07.674Z",
    "started_at": null,
    "completed_at": null,
    "claimed_at": null
  }
}
